postId,id,name,email,body
1,1,id labore ex et quam laborum,Eliseo@gardner.biz,"laudantium enim quasi est quidem magnam voluptate ipsam eos
tempora quo necessitatibus
dolor quam autem quasi
reiciendis et nam sapiente accusantium"
1,2,quo vero reiciendis velit similique earum,Jayne_Kuhic@sydney.com,"est natus enim nihil est dolore omnis voluptatem numquam
et omnis occaecati quod ullam at
voluptatem error expedita pariatur
nihil sint nostrum voluptatem reiciendis et"
1,3,odio adipisci rerum aut animi,Nikita@garfield.biz,"quia molestiae reprehenderit quasi aspernatur
aut expedita occaecati aliquam eveniet laudantium
omnis quibusdam delectus saepe quia accusamus maiores nam est
cum et ducimus et vero voluptates excepturi deleniti ratione"
1,4,alias odio sit,Lew@alysha.tv,"non et atque
occaecati deserunt quas accusantium unde odit nobis qui voluptatem
quia voluptas consequuntur itaque dolor
et qui rerum deleniti ut occaecati"
1,5,vero eaque aliquid doloribus et culpa,Hayden@althea.biz,"harum non quasi et ratione
tempore iure ex voluptates in ratione
harum architecto fugit inventore cupiditate
voluptates magni quo et"
2,6,et fugit eligendi deleniti quidem qui sint nihil autem,Presley.Mueller@myrl.com,"doloribus at sed quis culpa deserunt consectetur qui praesentium
accusamus fugiat dicta
voluptatem rerum ut voluptate autem
voluptatem repellendus aspernatur dolorem in"
2,7,repellat consequatur praesentium vel minus molestias voluptatum,Dallas@ole.me,"maiores sed dolores similique labore et inventore et
quasi temporibus esse sunt id et
eos voluptatem aliquam
aliquid ratione corporis molestiae mollitia quia et magnam dolor"
2,8,et omnis dolorem,Mallory_Kunze@marie.org,"ut voluptatem corrupti velit
ad voluptatem maiores
et nisi velit vero accusamus maiores
voluptates quia aliquid ullam eaque"
2,9,provident id voluptas,Meghan_Littel@rene.us,"sapiente assumenda molestiae atque
adipisci laborum distinctio aperiam et ab ut omnis
et occaecati aspernatur odit sit rem expedita
quas enim ipsam minus"
2,10,eaque et deleniti atque tenetur ut quo ut,Carmen_Keeling@caroline.name,"voluptate iusto quis nobis reprehenderit ipsum amet nulla
quia quas dolores velit et non
aut quia necessitatibus
nostrum quaerat nulla et accusamus nisi facilis"
3,11,fugit labore quia mollitia quas deserunt nostrum sunt,Veronica_Goodwin@timmothy.net,"ut dolorum nostrum id quia aut est
fuga est inventore vel eligendi explicabo quis consectetur
aut occaecati repellat id natus quo est
ut blanditiis quia ut vel ut maiores ea"
3,12,modi ut eos dolores illum nam dolor,Oswald.Vandervort@leanne.org,"expedita maiores dignissimos facilis
ipsum est rem est fugit velit sequi
eum odio dolores dolor totam
occaecati ratione eius rem velit"
3,13,aut inventore non pariatur sit vitae voluptatem sapiente,Kariane@jadyn.tv,"fuga eos qui dolor rerum
inventore corporis exercitationem
corporis cupiditate et deserunt recusandae est sed quis culpa
eum maiores corporis et"
3,14,et officiis id praesentium hic aut ipsa dolorem repudiandae,Nathan@solon.io,"vel quae voluptas qui exercitationem
voluptatibus unde sed
minima et qui ipsam aspernatur
expedita magnam laudantium et et quaerat ut qui dolorum"
3,15,debitis magnam hic odit aut ullam nostrum tenetur,Maynard.Hodkiewicz@roberta.com,"nihil ut voluptates blanditiis autem odio dicta rerum
quisquam saepe et est
sunt quasi nemo laudantium deserunt
molestias tempora quo quia"
4,16,perferendis temporibus delectus optio ea eum ratione dolorum,Christine@ayana.info,"iste ut laborum aliquid velit facere itaque
quo ut soluta dicta voluptate
error tempore aut et
sequi reiciendis dignissimos expedita consequuntur libero sed fugiat facilis"
4,17,eos est animi quis,Preston_Hudson@blaise.tv,"consequatur necessitatibus totam sed sit dolorum
recusandae quae odio excepturi voluptatum harum voluptas
quisquam sit ad eveniet delectus
doloribus odio qui non labore"
4,18,aut et tenetur ducimus illum aut nulla ab,Vincenza_Klocko@albertha.name,"veritatis voluptates necessitatibus maiores corrupti
neque et exercitationem amet sit et
ullam velit sit magnam laborum
magni ut molestias"
4,19,sed impedit rerum quia et et inventore unde officiis,Madelynn.Gorczany@darion.biz,"doloribus est illo sed minima aperiam
ut dignissimos accusantium tempore atque et aut molestiae
magni ut accusamus voluptatem quos ut voluptates
quisquam porro sed architecto ut"
4,20,molestias expedita iste aliquid voluptates,Mariana_Orn@preston.org,"qui harum consequatur fugiat
et eligendi perferendis at molestiae commodi ducimus
doloremque asperiores numquam qui
ut sit dignissimos reprehenderit tempore"
5,21,aliquid rerum mollitia qui a consectetur eum sed,Noemie@marques.me,"deleniti aut sed molestias explicabo
commodi odio ratione nesciunt
voluptate doloremque est
nam autem error delectus"
5,22,porro repellendus aut tempore quis hic,Khalil@emile.co.uk,"qui ipsa animi nostrum praesentium voluptatibus odit
qui non impedit cum qui nostrum aliquid fuga explicabo
voluptatem fugit earum voluptas exercitationem temporibus dignissimos distinctio
esse inventore reprehenderit quidem ut incidunt nihil necessitatibus rerum"
5,23,quis tempora quidem nihil iste,Sophia@arianna.co.uk,"voluptates provident repellendus iusto perspiciatis ex fugiat ut
ut dolor nam aliquid et expedita voluptate
sunt vitae illo rerum in quos
vel eligendi enim quae fugiat est"
5,24,in tempore eos beatae est,Jeffery@juwan.us,"repudiandae repellat quia
sequi est dolore explicabo nihil et
et sit et
et praesentium iste atque asperiores tenetur"
5,25,autem ab ea sit alias hic provident sit,Isaias_Kuhic@jarrett.net,"sunt aut quae laboriosam sit ut impedit
adipisci harum laborum totam deleniti voluptas odit rem ea
non iure distinctio ut velit doloribus
et non ex"
